{
  "version": "1.0.0",
  "intentions": [],
  "entities": [],
  "dialogs": [
    {
      "name": "onboarding",
      "actions": [
        {
          "action": "call_integration",
          "integration": "wizeline_integration",
          "function": "get_bot_developers",
          "function_params": []
        },
        {
          "action": "send_carousel",
          "card_content": {
            "title": "{{$name}}",
            "description": "{{$alias}}",
            "image_url": "{{$avatar}}",
            "buttons": [
              {
                "label": "Details",
                "payload": "http://www.wizeline.com/profile",
                "type": "open_url"
              },
              {
                "label": "More Details",
                "payload": "http://www.wizeline.com/profile",
                "type": "open_url"
              }
            ]
          },
          "content_source": "$wizeline_integration.get_bot_developers"
        }
      ]
    }
  ],
  "qa": []
}
