{
  "version": "1.0.0",
  "intentions": [],
  "entities": [],
  "dialogs": [
    {
      "name": "onboarding",
      "actions": [
        {
          "text": "question?",
          "action": "ask_for_input",
          "var_name": "bar"
        },
        {
          "action": "send_text",
          "text": "{{$bar}} has entity foo",
          "condition": [
            "$bar",
            "has_entity",
            "foo"
          ]
        }
      ]
    }
  ],
  "qa": []
}
